<?xml version="1.0" encoding="UTF-8"?>
<xna-type xmlns:xsi="http://www.w3.org/2001/XMLSchema-instance"
          xsi:noNamespaceSchemaLocation="../../xna.xsd"
          name="OutOfVideoMemoryException" kind="class"
          namespace="Microsoft.Xna.Framework.Graphics"
          assembly="Microsoft.Xna.Framework.Graphics"
          baseClass="ExternalException"
          modifier="sealed">
  <summary><![CDATA[The exception that is thrown when Direct3D does not have enough display memory to perform the operation.]]></summary>
  <syntax><![CDATA[[SerializableAttribute]
public sealed class OutOfVideoMemoryException : ExternalException]]></syntax>
  <platforms>
    <platform>Xbox 360</platform>
    <platform>Windows XP SP2</platform>
    <platform>Windows Vista</platform>
  </platforms>
  <constructors>
    <constructor signature="OutOfVideoMemoryException()">
      <summary><![CDATA[Initializes a new instance of this class.]]></summary>
      <syntax><![CDATA[public OutOfVideoMemoryException ()]]></syntax>
      <remarks><![CDATA[This constructor initializes the Message property of the new instance to a system-supplied message that describes the error, such as "Direct3D does not have enough display memory to perform the operation." This message takes into account the current system culture. The following table shows the initial property values for an instance of OutOfVideoMemoryException . Property Value InnerException A null reference. Message The localized error message string.]]></remarks>
      <platforms>
        <platform>Xbox 360</platform>
        <platform>Windows XP SP2</platform>
        <platform>Windows Vista</platform>
      </platforms>
    </constructor>
    <constructor signature="OutOfVideoMemoryException(String)">
      <summary><![CDATA[Initializes a new instance of this class with a specified error message.]]></summary>
      <syntax><![CDATA[public OutOfVideoMemoryException (
         string message
)]]></syntax>
      <parameters>
        <parameter name="message" type="string"><![CDATA[A message that describes the error.]]></parameter>
      </parameters>
      <remarks><![CDATA[The content of the message parameter is intended to be understood by humans. The caller of this constructor is required to ensure that this string has been localized for the current system culture. The following table shows the initial property values for an instance of OutOfVideoMemoryException . Property Value InnerException A null reference. Message The localized error message string.]]></remarks>
      <platforms>
        <platform>Xbox 360</platform>
        <platform>Windows XP SP2</platform>
        <platform>Windows Vista</platform>
      </platforms>
    </constructor>
    <constructor signature="OutOfVideoMemoryException(String, Exception)">
      <summary><![CDATA[Initializes a new instance of this class with a specified error message and a reference to the inner exception that is the cause of this exception.]]></summary>
      <syntax><![CDATA[public OutOfVideoMemoryException (
         string message,
         Exception inner
)]]></syntax>
      <parameters>
        <parameter name="message" type="string"><![CDATA[A message that describes the error.]]></parameter>
        <parameter name="inner" type="Exception"><![CDATA[The exception that is the cause of the current exception. If the parameter is not a null reference, the current exception is raised in a catch block that handles the inner exception.]]></parameter>
      </parameters>
      <remarks><![CDATA[The content of the message parameter is intended to be understood by humans. The caller of this constructor is required to ensure that this string has been localized for the current system culture. An exception that is thrown as a direct result of a previous exception should include a reference to the previous exception in the InnerException property. The InnerException property returns the same value that is passed into the constructor, or a null reference if the InnerException property does not supply the inner exception value to the constructor. The following table shows the initial property values for an instance of OutOfVideoMemoryException . Property Value InnerException A null reference. Message The localized error message string.]]></remarks>
      <platforms>
        <platform>Xbox 360</platform>
        <platform>Windows XP SP2</platform>
        <platform>Windows Vista</platform>
      </platforms>
    </constructor>
  </constructors>
  <properties>
  </properties>
  <methods>
  </methods>
  <fields>
  </fields>
  <events>
  </events>
</xna-type>