<?xml version="1.0" encoding="UTF-8"?>
<xna-type xmlns:xsi="http://www.w3.org/2001/XMLSchema-instance"
          xsi:noNamespaceSchemaLocation="../../xna.xsd"
          name="GraphicsDeviceCapabilities.PixelShaderCaps" kind="struct"
          namespace="Microsoft.Xna.Framework.Graphics"
          assembly="Microsoft.Xna.Framework.Graphics">
  <summary><![CDATA[Represents pixel shader capabilities.]]></summary>
  <syntax><![CDATA[public struct GraphicsDeviceCapabilities.PixelShaderCaps]]></syntax>
  <platforms>
    <platform>Xbox 360</platform>
    <platform>Windows XP SP2</platform>
    <platform>Windows Vista</platform>
  </platforms>
  <constructors>
  </constructors>
  <properties>
  </properties>
  <methods>
  </methods>
  <fields>
  </fields>
  <events>
  </events>
</xna-type>