<?xml version="1.0" encoding="UTF-8"?>
<xna-type xmlns:xsi="http://www.w3.org/2001/XMLSchema-instance"
          xsi:noNamespaceSchemaLocation="../../xna.xsd"
          name="ContentProcessorAttribute" kind="class"
          namespace="Microsoft.Xna.Framework.Content.Pipeline"
          assembly="Microsoft.Xna.Framework.Content.Pipeline"
          baseClass="Attribute">
  <summary><![CDATA[Gets any existing content processor components.]]></summary>
  <syntax><![CDATA[public class ContentProcessorAttribute : Attribute]]></syntax>
  <remarks><![CDATA[If you are developing a custom processor, it must use this attribute. The processor must also extend the ContentProcessor class.]]></remarks>
  <platforms>
    <platform>Windows XP SP2</platform>
    <platform>Windows Vista</platform>
  </platforms>
  <constructors>
    <constructor signature="ContentProcessorAttribute()">
      <summary><![CDATA[Initializes an instance of ContentProcessorAttribute.]]></summary>
      <syntax><![CDATA[public ContentProcessorAttribute ()]]></syntax>
      <platforms>
        <platform>Windows XP SP2</platform>
        <platform>Windows Vista</platform>
      </platforms>
    </constructor>
  </constructors>
  <properties>
    <property name="DisplayName" type="Object" access="get;set">
      <summary><![CDATA[Gets or sets the string representing the processor in a user interface. This name is not used by the content pipeline and should not be passed to the BuildAssets task. It is used for display purposes only.]]></summary>
      <syntax><![CDATA[public virtual string DisplayName { get; set; }]]></syntax>
      <platforms>
        <platform>Windows XP SP2</platform>
        <platform>Windows Vista</platform>
      </platforms>
    </property>
  </properties>
  <methods>
  </methods>
  <fields>
  </fields>
  <events>
  </events>
</xna-type>